{
  "intent": "qa",
  "canonicalUrl": "https://example.com/faq/product-info",
  "language": "en",
  "contentType": "other",
  "mediaType": "text/html",
  "model": {
    "id": "llm:gpt4@20240806",
    "provider": "openai",
    "name": "gpt-4",
    "version": "20240806",
    "digest": "sha256:3456789012abcdef3456789012abcdef3456789012abcdef3456789012abcdef"
  },
  "qa_pairs": [
    {
      "index": 0,
      "question": "What are the system requirements for running this software?",
      "answer": "Based on the documentation, the software requires Windows 10 or later as the operating system. You'll need at least 8GB of RAM, though 16GB is recommended for optimal performance. A DirectX 11 compatible graphics card is necessary, and you should have 50GB of free storage space available for installation.",
      "confidence": 0.92,
      "unanswered": false,
      "answerType": "factual",
      "sources": [
        {
          "canonicalUrl": "https://example.com/faq/product-info",
          "span": {
            "start": 20,
            "end": 75,
            "unit": "char"
          },
          "quote": "Windows 10 or later, 8GB RAM minimum (16GB recommended)"
        },
        {
          "canonicalUrl": "https://example.com/faq/product-info",
          "span": {
            "start": 77,
            "end": 112,
            "unit": "char"
          },
          "quote": "DirectX 11 compatible graphics card"
        },
        {
          "canonicalUrl": "https://example.com/faq/product-info",
          "span": {
            "start": 114,
            "end": 142,
            "unit": "char"
          },
          "quote": "50GB available storage space"
        }
      ]
    },
    {
      "index": 1,
      "question": "Is there a free trial available?",
      "answer": "Yes, we offer a 14-day free trial with full access to all features.",
      "confidence": 0.95,
      "unanswered": false,
      "answerType": "factual",
      "sources": [
        {
          "canonicalUrl": "https://example.com/faq/product-info",
          "span": {
            "start": 200,
            "end": 250,
            "unit": "char"
          },
          "quote": "14-day free trial with full access to all features"
        }
      ]
    }
  ],
  "provenance": {
    "contentHash": "sha256:c3d4e5f6789012345678901234567890abcdef1234567890abcdef123456789",
    "generatedAt": "2024-10-13T16:00:00Z",
    "sourceUrl": "https://example.com/faq/product-info",
    "sourceTitle": "Product Information FAQ"
  },
  "length": {
    "inputTokens": 150,
    "outputTokens": 85,
    "totalTokens": 235,
    "truncated": false,
    "truncateReason": "none"
  }
}
